Konokono aitwaye Turbo anacheza mchezo kwenye ubao wenye safu mlalo \(2024\) na safu wima \(2023\). Kuna majitu yaliyofichwa katika visanduku \(2022\). Mwanzoni, Turbo hajui mahali ambapo mnyama yeyote amewekwa, lakini anajua kuwa kila safu mlalo isipokuwa ya kwanza na ya mwisho ina mnyama mmoja pekee, na kila safu wima ina mnyama mmoja tu au haina kabisa.  Turbo anafanya majaribio kadhaa ya kutoka safu mlalo ya kwanza hadi safu mlalo ya mwisho. Katika kila jaribio, anachagua kuanza kutoka kisanduku chochote katika safu ya kwanza, kisha husogea tena na tena kwenye kisanduku cha jirani kinachoambatana moja kwa moja na upande wake mmoja. (Anaruhusiwa kurejea kwenye kisanduku alichokwisha kutembelea awali.) Akiingia kwenye kisanduku chenye mnyama, jaribio lake linaisha na anarejeshwa kwenye safu mlalo ya kwanza ili kuanza jaribio jipya. Majitu hayatembei kutoka mahali yalipo, na Turbo hukumbuka kama kila kisanduku alichokitembelea kina mnyama au la. Ikiwa atafika kwenye kisanduku chochote kilicho kwenye safu mlalo ya mwisho, jaribio linaisha na mchezo unaisha mara moja.  Tafuta thamani ya chini kabisa ya \(n\) ambayo kwayo Turbo atakuwa na mkakati unaomhakikishia kufika safu ya mwisho katika jaribio la \(n\) au mapema zaidi, bila kujali mahali ambapo majitu yamewekwa.	3
Ikiwa $\mathbb{Q}$ ni mkusanyiko wa namba za kirazini, tunasema kuwa fumbo $f: \mathbb{Q} \to \mathbb{Q}$ ni aquaesulian ikiwa linatimiza sharti lifuatalo: kwa kila $x,y \in \mathbb{Q}$, \[ f(x+f(y)) = f(x) + y \quad \text{au} \quad f(f(x)+y) = x + f(y). \] Onesha kwamba ipo namba kamili $c$ kiasi kwamba, kwa kila fumbo aquaesulian $f$, kuna idadi isiyozidi $c$ ya namba tofauti za kirazini zinazoweza kuandikwa katika umbo $f(r) + f(-r)$ kwa namba fulani ya kirazini $r$, kisha tafuta thamani ndogo zaidi inayowezekana ya $c$.	2
Iwe $n$ ni namba halisi chanya. Pembetatu ya Kijapani ina miduara $1 + 2 + \dots + n$ iliyopangwa katika umbo la pembetatu sawa, kiasi kwamba kwa kila $i = 1$, $2$, $\dots$, $n$, safu ya $i$ ina miduara $i$ ambapo mmoja tu kati yake umewekwa rangi nyekundu. Njia ya Ninja katika pembetatu ya Kijapani ni mfuatano wenye miduara $n$ unaopatikana kwa kuanzia kwenye safu ya juu kabisa, kisha kila mara ukishuka kutoka duara moja kwenda kwenye moja kati ya miduara miwili iliyo moja kwa moja chini yake na kumalizia kwenye safu ya chini kabisa. Hapa chini ni mfano wa pembetatu ya Kijapani ikiwa na $n = 6$, pamoja na njia moja ya Ninja iliyo na miduara miwili yenye rangi nyekundu. [asy] // credit to vEnhance for the diagram (which was better than my original asy): size(4cm);  pair X = dir(240); pair Y = dir(0);  path c = scale(0.5)*unitcircle;  int[] t = {0,0,2,2,3,0};  for (int i=0; i<=5; ++i) {     for (int j=0; j<=i; ++j) {  filldraw(shift(i*X+j*Y)*c, (t[i]==j) ? lightred : white);  draw(shift(i*X+j*Y)*c);     }  }  draw((0,0)--(X+Y)--(2*X+Y)--(3*X+2*Y)--(4*X+2*Y)--(5*X+2*Y),linewidth(1.5));  path q = (3,-3sqrt(3))--(-3,-3sqrt(3));  draw(q,Arrows(TeXHead, 1));  label("$n = 6$", q, S); label("$n = 6$", q, S); [/asy] Kwa kutegemea $n$, tafuta thamani kubwa zaidi ya $k$ kiasi kwamba katika kila pembetatu ya Kijapani ipo njia ya Ninja yenye angalau miduara $k$ yenye rangi nyekundu.	$\lfloor \log_{2} n  \rfloor + 1$
Tuseme $n$ ni namba kamili chanya. Mraba wa Kinordiki ni ubao wenye vipande $n \times n$ uliojaa namba zote kuanzia $1$ mpaka $n^2$ ambapo kila kipande kina namba moja tu. Vipande viwili tofauti vinahesabiwa kuwa jirani ikiwa vinashirikiana upande mmoja. Kila kipande kinachopakana tu na vipande vyenye namba kubwa zaidi huitwa bonde. Njia ya kupanda ni mfuatano wa kipande kimoja au zaidi ambapo: (i) kipande cha kwanza katika mfuatano ni bonde, (ii) kila kipande kinachofuata katika mfuatano kinapakana na kipande kilichotangulia, na (iii) namba zilizomo ndani ya vipande hivi katika mfuatano zinaongezeka.  Tafuta, kama kazi ya $n$, idadi ndogo kabisa inayowezekana ya jumla ya njia za kupanda katika mraba wa Kinordiki.	$2n^2 - 2n + 1$
Profesa Oak anawalisha Pokémon wake $100$. Kila Pokémon ana bakuli lenye uwezo maalum unaoelezewa kwa idadi halisi chanya katika kilogramu. Uwezo huu unajulikana kwa Profesa Oak. Jumla ya uwezo wa mabakuli yote ni kilogramu $100$. Profesa Oak anagawa chakula chenye jumla ya kilogramu $100$ ili kwamba kila Pokémon apokee kiasi kinacholingana na namba nzima isiyo hasi ya kilogramu (ambayo inaweza kuzidi uwezo wa bakuli husika). Kiwango cha kutoridhika cha Pokémon aliyepokea kilogramu $N$ za chakula na ambaye bakuli lake lina uwezo wa kilogramu $C$ ni sawa na thamani $\lvert N - C\rvert$. Tafuta namba halisi ndogo zaidi $D$ ambayo, bila kujali uwezo wa mabakuli, Profesa Oak anaweza kugawa chakula kwa namna ambayo jumla ya viwango vya kutoridhika vya Pokémon wote $100$ haitazidi $D$.	50
Bainisha urefu mkubwa zaidi $L$ wa mfuatano $a_1,\dots,a_L$ wa nambari chanya kamili unaokidhi masharti yote mawili yafuatayo: kila kiungo katika mfuatano huo ni sawa au kidogo kuliko $2^{2023}$, na hakuna mfululizo wowote wa vipengele mfululizo $a_i,a_{i+1},\dots,a_j$ (ambapo $1\le i\le j\le L$) pamoja na uchaguzi wa alama $s_i,s_{i+1},\dots,s_j\in\{1,-1\}$ unaoweza kutoa jumla ifuatayo:\[s_ia_i+s_{i+1}a_{i+1}+\dots+s_ja_j=0.\]	$2^{2024} - 1$
Ikiwa $n\geqslant 2$ ni nambari nzima chanya, Paul ana ukanda wa mstatili wenye vipimo $1\times n^2$, uliojengwa na miraba midogo midogo $n^2$, ambapo mraba wa $i$ umeandikwa nambari $i$ kwa kila $1\leqslant i\leqslant n^2$. Anataka kuukata ukanda huo katika vipande kadhaa, ambapo kila kipande kina jumla ya miraba midogo midogo inayofuatana, kisha avihamishe vipande hivyo (bila kuvizungusha au kuvipindua) ili kupata mraba mkubwa wenye vipimo $n\times n$ unaokidhi sharti lifuatalo: ikiwa mraba mdogo ulio katika safu ya $i$ na safuwima ya $j$ umeandikwa nambari $a_{ij}$, basi lazima itimie kwamba $a_{ij}-(i+j-1)$ inagawanyika kwa $n$. Bainisha idadi ndogo zaidi ya vipande ambavyo Paul anahitaji kukata ili kutimiza hili.	$2n - 1$
Funguvisiwa la Imomi lina visiwa $n\geq 2$. Kati ya kila jozi ya visiwa tofauti kuna njia moja ya kipekee ya feri inayokwenda pande zote mbili, na kila njia ya feri inaendeshwa na mojawapo ya kampuni $k$. Inajulikana kwamba ikiwa kampuni yoyote miongoni mwa hizi $k$ itasitisha njia zake zote za feri, basi msafiri yeyote, bila kujali ataanzia wapi, hataweza kutembelea visiwa vyote mara moja tu (hasa bila kurudi tena katika kisiwa alichoanzia). Bainisha thamani kubwa zaidi iwezekanavyo ya $k$ kulingana na $n$.	$\lfloor \log_{2}n \rfloor$
Ikiwa $a_1, \dots, a_n, b_1, \dots, b_n$ ni nambari $2n$ chanya za vizima kiasi kwamba mazao $n+1$ yafuatayo \[a_1 a_2 a_3 \cdots a_n,\; b_1 a_2 a_3 \cdots a_n,\; b_1 b_2 a_3 \cdots a_n,\; \dots,\; b_1 b_2 b_3 \cdots b_n\] yatengeneza mfululizo wa hesabu unaoongezeka kabisa (kwa tofauti sawa kati ya kila kiwango kinachofuata). Bainisha nambari ndogo zaidi ambayo inaweza kuwa tofauti ya kawaida ya mfululizo huo wa hesabu.	$n!$
Iwe $k\ge2$ ni nambari kamili. Tafuta nambari kamili ndogo kabisa $n \ge k+1$ yenye sifa kwamba ipo seti ya nambari halisi tofauti $n$, ambapo kila elementi yake inaweza kuandikwa kama jumla ya elementi nyingine tofauti $k$ za seti hiyo.	$k + 4$
Tuseme $\mathbb R$ ni kundi la namba halisi. Tutaashiria kwa $\mathcal F$ mkusanyiko wa vitendaji vyote $f\colon\mathbb R\to\mathbb R$ ambavyo vinakidhi $$f(x + f(y)) = f(x) + f(y)$$ kwa kila $x,y\in\mathbb R$. Tafuta namba zote za kiratini $q$ zenye sifa kwamba kwa kila kitendaji $f\in\mathcal F$, ipo namba fulani $z\in\mathbb R$ inayotimiza $f(z)=qz$.	$\left\{ \frac{n+1}{n}: n\in\mathbb{Z}, n\neq0 \right\}$
Mlolongo wa $\pm 1$ ni mlolongo wenye namba $2022$, $a_1, \ldots, a_{2022},$ ambapo kila namba ni aidha $+1$ au $-1$. Bainisha thamani kubwa zaidi ya $C$ kiasi kwamba, kwa mlolongo wowote wa $\pm 1$, ipo namba kamili $k$ na fahirisi $1 \le t_1 < \ldots < t_k \le 2022$ zinazokidhi $t_{i+1} - t_i \le 2$ kwa kila $i$, na $$\left| \sum_{i = 1}^{k} a_{t_i} \right| \ge C.$$	506
Nambari huitwa ya Kinorwei ikiwa ina vigawanyo vitatu tofauti chanya ambavyo jumla yao ni sawa na $2022$. Bainisha nambari ndogo kabisa ya Kinorwei. (Kumbuka: Idadi kamili ya vigawanyo chanya vya nambari ya Kinorwei inaweza kuwa kubwa kuliko $3$.)	1344
Amua kazi zote \( f: \mathbb{R} \rightarrow \mathbb{R} \) zinazotimiza \[ (f(a)-f(b))(f(b)-f(c))(f(c)-f(a)) = f(ab^2+bc^2+ca^2) - f(a^2b+b^2c+c^2a) \] kwa namba zote halisi \( a \), \( b \), na \( c \).	$f(x)=\alphax+\beta$ or $f(x)=\alphax^3+\beta$ where $\alpha \in \{-1,0,1\}$ and $\beta\in\mathbb{R}$
Bainisha nambari kubwa zaidi ya kitamsingi $N$ ambayo inawezekana kuwepo jedwali $T$ la nambari za kitamsingi lenye safu mlalo $N$ na safu wima $100$ lenye sifa zifuatazo: $\text{(i)}$ Kila safu mlalo ina nambari $1$, $2$, $\ldots$, $100$ zilizopangwa kwa namna fulani. $\text{(ii)}$ Kwa kila safu mlalo mbili tofauti $r$ na $s$, ipo safu wima $c$ ambayo inakidhi $|T(r,c) - T(s,c)| \geq 2$. (Hapa $T(r,c)$ ni kiingilio katika safu mlalo $r$ na safu wima $c$.)	$\frac{100!}{2^{50}}$
Iwe $R^+$ ni seti ya namba halisi chanya. Bainisha fomula zote $f:R^+$ $\rightarrow$ $R^+$ zinazokidhi sharti lifuatalo kwa namba zote halisi chanya $x$ na $y$: $$f(x+f(xy))+y=f(x)f(y)+1$$	$f(x) = x + 1$
Kuna namba kamili \( n > 1 \). Kuna vituo \( n^2 \) katika mteremko wa mlima, vyote vikiwa katika miinuko tofauti. Kila moja kati ya kampuni mbili za magari yanayopanda kwa nyaya, \( A \) na \( B \), inaendesha magari \( k \); kila gari linaunganisha kituo kimoja kwenda kituo kingine chenye muinuko mkubwa zaidi (hakuna vituo vya kati). Magari \( k \) ya kampuni \( A \) yana vituo tofauti vya kuanzia na vituo tofauti vya kumalizia, na gari linaloanzia mahali palipo juu zaidi pia humalizia mahali palipo juu zaidi. Masharti hayo hayo yanatumika kwa kampuni \( B \). Tunasema vituo viwili vimeunganishwa na kampuni fulani ikiwa inawezekana kuondoka katika kituo cha chini na kufika kituo cha juu kwa kutumia gari moja au zaidi la kampuni hiyo (hakuruhusiwi matembezi mengine yoyote kati ya vituo hivyo). Bainisha thamani ndogo zaidi chanya ya \( k \) ambayo inaweza kuhakikisha kwamba kuna angalau vituo viwili vilivyounganishwa na kampuni zote mbili.	$n^2 - n + 1$
Nambari za Fibonacci $F_0, F_1, F_2, . . .$ zinafafanuliwa ki-induksheni kwa $F_0=0, F_1=1$, na $F_{n+1}=F_n+F_{n-1}$ kwa $n \ge 1$. Ukipewa nambari kamili $n \ge 2$, tafuta idadi ndogo zaidi ya vipengele vya seti $S$ ya nambari kamili, kiasi kwamba kwa kila $k=2, 3, . . . , n$ kuna $x, y \in S$ ambapo $x - y = F_k$.	$\lceil \frac{n}{2} \rceil + 1$
Wachezaji $A$ na $B$ wanacheza mchezo kwenye ubao ambao awali una namba 1 zipatazo 2020. Katika kila raundi, mchezaji $A$ anafuta namba mbili $x$ na $y$ kutoka ubaoni, na kisha mchezaji $B$ anaandika moja kati ya namba hizi mbili: ama $x+y$ au $|x - y|$ kwenye ubao. Mchezo unaisha mara tu baada ya raundi fulani ikiwa mojawapo ya masharti yafuatayo yametimia: $(1)$ mojawapo ya namba zilizoko ubaoni ni kubwa kuliko jumla ya namba zote zilizobaki; $(2)$ namba zote zilizosalia ubaoni ni sifuri tu. Baada ya hapo, mchezaji $B$ lazima ampatie mchezaji $A$ idadi ya biskuti sawa na idadi ya namba zilizoko ubaoni. Mchezaji $A$ anataka kupata biskuti nyingi kadiri iwezekanavyo, huku mchezaji $B$ akitaka kutoa biskuti chache iwezekanavyo. Ikiwa wachezaji wote wawili wanacheza kwa mbinu bora zaidi, tafuta idadi ya biskuti atakazopata mchezaji $A$.	7
Benki ya Bath hutoa sarafu zenye herufi $H$ upande mmoja na $T$ upande mwingine. Harry ana sarafu $n$ za aina hizi zilizopangwa kwenye mstari kutoka kushoto kwenda kulia. Yeye hurudia kufanya kitendo hiki kifuatacho: Ikiwa kuna sarafu $k>0$ zinazoonesha $H$, basi anageuza sarafu ya $k$ kutoka kushoto; vinginevyo, ikiwa hakuna sarafu yenye $H$, basi sarafu zote zinaonesha $T$ na anasimama. Kwa mfano, kama $n=3$, mchakato unaoanza na mpangilio $THT$ utakuwa  $THT \to HHT \to HTT \to TTT$, ambao unasimama baada ya hatua tatu.  (a) Onesha kwamba kwa kila mpangilio wa awali, Harry atasimama baada ya idadi yenye kikomo ya hatua.  (b) Kwa kila mpangilio wa awali $C$, iweke $L(C)$ kuwa idadi ya hatua zinazofanyika kabla Harry hajasimama. Kwa mfano, $L(THT) = 3$ na $L(TTT) = 0$. Bainisha thamani wastani ya $L(C)$ kwa michanganyiko yote $2^n$ inayowezekana ya mipangilio ya awali $C$.	$\frac{n(n+1)}{4}$
Kwa nambari halisi zozote mbili tofauti $x$ na $y$, tunafafanua $D(x,y)$ kama nambari kamili pekee $d$ inayotimiza $2^d\le |x - y| < 2^{d+1}$. Tukiwa na seti ya nambari halisi $\mathcal F$ na kipengele $x\in \mathcal F$, tunasema kwamba mizani ya $x$ katika $\mathcal F$ ni thamani za $D(x,y)$ kwa $y\in \mathcal F$ ambapo $x\neq y$. Iwe $k$ ni nambari kamili chanya iliyotolewa. Ikiwa kila kipengele $x$ kilicho ndani ya $\mathcal F$ kina mizani tofauti zisizozidi $k$ katika $\mathcal F$ (zingatia kwamba mizani hii inaweza kutegemea $x$). Ni upi wingi wa juu zaidi unaowezekana wa seti $\mathcal F$?	$2^k$
Iwe $a_0,a_1,a_2,\dots $ ni mfuatano wa namba halisi ambapo $a_0=0,\; a_1=1,$ na kwa kila $n\geq 2$ ipo namba $k$ yenye $1 \leq k \leq n$ inayotimiza \[ a_n = \frac{a_{n-1}+\dots+ a_{n-k}}{k}. \] Tafuta thamani kubwa kabisa inayowezekana ya $a_{2018}-a_{2017}$.	$\frac{2016}{2017^2}$
Iwe $q$ ni namba halisi. Gugu ana kitambaa ambacho kimeandikwa namba kumi tofauti halisi, na anaandika mistari mitatu ifuatayo ya namba halisi ubaoni: Katika mstari wa kwanza, Gugu anaandika kila namba ya umbo $a - b$, ambapo $a$ na $b$ ni namba mbili (si lazima kuwa tofauti) kutoka kwenye kitambaa chake. Katika mstari wa pili, Gugu anaandika kila namba ya umbo $qab$, ambapo $a$ na $b$ ni namba mbili (si lazima kuwa tofauti) kutoka mstari wa kwanza. Katika mstari wa tatu, Gugu anaandika kila namba ya umbo $a^2 + b^2 - c^2 - d^2$, ambapo $a, b, c, d$ ni namba nne (si lazima kuwa tofauti) kutoka mstari wa kwanza. Tafuta thamani zote za $q$ ambazo, haijalishi ni namba zipi zilizoandikwa kwenye kitambaa cha Gugu, kila namba katika mstari wa pili huwa pia ipo katika mstari wa tatu.	${-2,0,2}$
Tafuta thamani ndogo zaidi ya konstanti \( C > 0 \) ambayo kauli ifuatayo inashikilia: kati ya namba zozote tano halisi chanya \( a_1,a_2,a_3,a_4,a_5 \) (si lazima ziwe tofauti), daima inawezekana kuchagua viambishi tofauti \( i,j,k,l \) ili \[ \left| \frac{a_i}{a_j} - \frac{a_k}{a_l} \right| \le C. \]	$\frac{1}{2}$
Mlinganyo  $$(x-1)(x-2)\cdots(x-2016)=(x-1)(x-2)\cdots (x-2016)$$  umeandikwa ubaoni, ukiwa na vipengele 2016 vya mstari kila upande. Thamani ndogo zaidi ya $k$ inapowezekana kufuta vipengele vya mstari $k$ kati ya vipengele hivi $4032$ ili angalau kipengele kimoja kibaki katika kila upande na mlinganyo unaobaki usiwe na suluhisho halisi ni ipi?	2016
Tafuta thamani kubwa zaidi ya kitufe halisi \(a\) kiasi kwamba kwa kila \(n \geq 1\) na kwa nambari halisi zozote \(x_0, x_1, ..., x_n\) zinazokidhi \(0 = x_0 < x_1 < x_2 < \dots < x_n\), tunayo \[ \frac{1}{x_1 - x_0} + \frac{1}{x_2 - x_1} + \dots + \frac{1}{x_n - x_{n - 1}} \geq a\left(\frac{2}{x_1} + \frac{3}{x_2} + \dots + \frac{n + 1}{x_n}\right) \]	$\frac{4}{9}$
Tafuta nambari zote kamili $n$ ambazo kila kisanduku cha jedwali lenye ukubwa wa $n \times n$ linaweza kujazwa na moja kati ya herufi $I$, $M$ na $O$ kwa namna ifuatayo: katika kila safu mlalo na safu wima, theluthi moja ya nafasi ni $I$, theluthi moja ni $M$, na theluthi moja ni $O$; na katika kila mchirizo ("diagonal") wowote, ikiwa idadi ya nafasi katika mchirizo huo inagawanyika kamili kwa tatu, basi theluthi moja ya nafasi ni $I$, theluthi moja ni $M$, na theluthi moja ni $O$. Dokezo. Mistari mlalo na wima ya jedwali la ukubwa $n \times n$ kila moja imepigwa lebo kutoka $1$ mpaka $n$ kwa mpangilio wa kawaida. Kwa hivyo kisanduku kimoja kinalingana na jozi ya namba $(i,j)$ ambapo $1 \le i,j \le n$. Kwa $n>1$, jedwali lina michirizo ("diagonals") $4n-2$ ya aina mbili. Mchirizo wa aina ya kwanza una nafasi zote $(i,j)$ ambapo $i+j$ ni namba isiyobadilika, na mchirizo wa aina ya pili una nafasi zote $(i,j)$ ambapo $i-j$ ni namba isiyobadilika.	9
Iwe $n$ ni nambari kamili chanya. Bainisha nambari kamili chanya ndogo kabisa $k$, yenye sifa ifuatayo: inawezekana kuweka alama kwenye visanduku $k$ katika ubao wenye ukubwa wa $2n \times 2n$, kiasi kwamba ipo njia moja pekee ya kuugawanya ubao huo katika vipande vya domino vya ukubwa $1 \times 2$ na $2 \times 1$, ambapo hakuna domino yoyote itakayokuwa na visanduku viwili vyenye alama.	$2n$
Seti ya nambari chanya huitwa yenye harufu ikiwa ina angalau vipengele viwili na kila kipengele chake kina kipengele cha msingi cha pamoja na angalau kipengele kimoja kingine kwenye seti hiyo. Iwe \( P(n)=n^2+n+1 \). Ni thamani gani ndogo kabisa ya nambari chanya \( b \) kiasi kwamba ipo nambari isiyo hasi \( a \) ambapo seti $$\{P(a+1),P(a+2),\ldots,P(a+b)\}$$ ni yenye harufu?	6
Ikiwa $n$ ni nambari maalum chanya. Tafuta thamani kubwa kabisa inayowezekana ya\[ \sum_{1 \le r < s \le 2n} (s - r - n)x_rx_s, \]ambapo $-1 \le x_i \le 1$ kwa kila $i = 1, \cdots , 2n$.	$n(n-1)$
Kwa seti yenye idadi kamili yenye kikomo \( A \) ya namba chanya, mgawanyo wa \( A \) katika seti mbili zisizoingiliana na zisizo tupu \( A_1 \) na \( A_2 \) unaitwa \(\textit{mzuri}\) ikiwa Kizio cha Pamoja Kidogo (KPK) cha vipengele vilivyo katika \( A_1 \) ni sawa na Kizigeu Kikubwa cha Pamoja (KKP) cha vipengele vilivyo katika \( A_2 \). Bainisha thamani ndogo kabisa ya \( n \) kiasi kwamba kuna seti yenye namba chanya \( n \) ambayo ina migawanyo mizuri sawa kabisa na \( 2015 \).	3024
Tuseme $\mathbb{Z}_{>0}$ ni seti ya nambari halisi chanya. Kwa kila nambari halisi chanya $k$, tunasema kazi $f: \mathbb{Z}_{>0} \to \mathbb{Z}_{>0}$ ni $k$-nzuri ikiwa $\gcd(f(m) + n, f(n) + m) \le k$ kwa kila $m \neq n$. Tafuta thamani zote za $k$ ambazo kazi $k$-nzuri ipo.	$k \geq 2$
Iwe $n \ge 2$ ni nambari kamili. Fikiria ubao wa chess wenye ukubwa wa $n \times n$ unaojumuisha miraba midogo $n^2$. Mpangilio wa kete $n$ aina ya rook kwenye ubao huu unaitwa wa amani ikiwa kila safu mlalo na kila safu wima ina rook moja pekee. Tafuta nambari kubwa zaidi chanya $k$ kiasi kwamba kwa kila mpangilio wa amani wa rook $n$, kuna mraba wenye ukubwa wa $k \times k$ ambao hauna rook yoyote katika miraba yake midogo yote $k^2$.	$\left\lfloor \sqrt{n-1} \right\rfloor$
Tafuta nambari zote tasa \( p>5 \) ambazo kuna nambari kamili \( a \) na \( r \) inayokidhi \( 1\leq r\leq p-1 \) yenye sifa ifuatayo: mfuatano \( 1,\,a,\,a^2,\,\ldots,\,a^{p-5} \) unaweza kupangwa upya kuwa mfuatano \( b_0,\,b_1,\,b_2,\,\ldots,\,b_{p-5} \) kiasi kwamba kwa kila \( 1\leq n\leq p-5 \), nambari \( b_n - b_{n-1} - r \) inagawanyika na \( p \).	7
Tuseme $c_0,\,c_1,\,c_2,\,\ldots$ ni mfuatano uliofafanuliwa hivi kwamba \[ \frac{1-3x-\sqrt{1-14x+9x^2}}{4}=\sum_{k=0}^\infty c_kx^k \] kwa $x$ iliyo ndogo vya kutosha. Kwa nambari nzima chanya $n$, iwe $A$ ni matriki ya ukubwa $n\times n$ ambayo kiingilio chake katika safu ya $i$, safu wima ya $j$ ni $c_{i+j-1}$, ambapo $i$ na $j$ ziko katika seti $\{1,\,\ldots,\,n\}$. Tafuta kiamua cha $A$.	$10^{\frac{n(n-1)}{2}}$
Hebu $n$ iwe nambari kamili chanya. Weka $a_{n,0}=1$. Kwa kila $k\geq 0$, chagua kwa bahati nasibu nambari kamili $m_{n,k}$ kutoka kwenye seti $\{1,\,\ldots,\,n\}$ kwa uwezekano sawa, kisha weka \[ a_{n,k+1}=\begin{cases}  a_{n,k}+1, & \text{ikiwa $m_{n,k}>a_{n,k}$;}\\[6pt] a_{n,k}, & \text{ikiwa $m_{n,k}=a_{n,k}$;}\\[6pt] a_{n,k}-1, & \text{ikiwa $m_{n,k}<a_{n,k}$.} \end{cases} \] Iwe $E(n)$ ni thamani tarajiwa ya $a_{n,n}$. Bainisha $\lim_{n\to\infty}E(n)/n$.	$\frac{1 - e^{-2}}{2}$
Amua nambari halisi chanya ndogo zaidi $r$ ambapo kuna uwezekano wa kuwepo kwa kazi zinazokubalika kutofautishwa $f: \mathbb{R} \rightarrow \mathbb{R}$ na $g: \mathbb{R} \rightarrow \mathbb{R}$ zinazotimiza masharti yafuatayo: (a) $f(0)>0$, (b) $g(0)=0$, (c) $\left|f^{\prime}(x)\right| \leq |g(x)|$ kwa kila $x$, (d) $\left|g^{\prime}(x)\right| \leq |f(x)|$ kwa kila $x$, na (e) $f(r)=0$.	$\frac{\pi}{2}$
Kwa nambari isiyo hasi nzima $k$, iwe $f(k)$ ni idadi ya tarakimu za moja katika muundo wa nambari msingi 3 wa $k$. Tafuta nambari changamano zote $z$ zinazokidhi: $$\sum_{k=0}^{3^{1010}-1}(-2)^{f(k)}(z+k)^{2023}=0$$	$-\frac{3^{1010}-1}{2}$ and $-\frac{3^{1010}-1}{2} \pm \frac{\sqrt{9^{1010}-1}}{4}i$
Kwa nambari isiyo hasi ya jumla \( n \) na mfuatano wa namba halisi zinazoongezeka kikamilifu \( t_0, t_1, \ldots, t_n \), iwe \( f(t) \) ni funge halisi inayolingana, iliyofafanuliwa kwa \( t \geq t_0 \) na yenye sifa zifuatazo: (a) \( f(t) \) ni endelevu kwa \( t \geq t_0 \), na inaweza kutofautishwa mara mbili kwa \( t > t_0 \) isipokuwa katika nukta \( t_1, \ldots, t_n \); (b) \( f(t_0) = 1/2 \); (c) \( \lim_{t \rightarrow t_k^{+}} f'(t) = 0 \) kwa \( 0 \leq k \leq n \); (d) Kwa \( 0 \leq k \leq n-1 \), tunayo \( f''(t) = k+1 \) iwapo \( t_k < t < t_{k+1} \), na \( f''(t) = n+1 \) kwa \( t > t_n \).  Kwa kuzingatia chaguo zote za \( n \) na \( t_0, t_1, \ldots, t_n \) zinazoridhisha \( t_k \geq t_{k-1}+1 \) kwa \( 1 \leq k \leq n \), ni thamani gani ndogo zaidi inayowezekana ya \( T \) ambayo \( f(t_0 + T) = 2023 \)?	29
Ikiwa $n$ ni nambari kamili yenye $n\geq 2.$ Kati ya polinomia zote halisi $p(x)$ za kiwango $n,$ ni idadi gani kubwa zaidi inayowezekana ya viambajengo hasi katika $p(x)^2?$	$2n-2$
Kwa $0 \leq p \leq 1/2,$ ziwepo vibadilika nasibu huru $X_1, X_2, \ldots$ kiasi kwamba $$X_i=\begin{cases} 1 & \text{yenye uwezekano } p, \\ -1 & \text{yenye uwezekano } p, \\ 0 & \text{yenye uwezekano } 1-2p, \end{cases}$$ kwa kila $i \geq 1.$ Tukipewa nambari chanya nzima $n$ na nambari nzima $b,a_1, \ldots, a_n,$ basi tuweke $P(b, a_1, \ldots, a_n)$ iwe uwezekano kwamba $a_1X_1+ \ldots + a_nX_n=b.$ Kwa thamani zipi za $p$ tunapata kwamba $$P(0, a_1, \ldots, a_n) \geq P(b, a_1, \ldots, a_n)$$ kwa nambari zote chanya nzima $n$ na nambari nzima zote $b, a_1,\ldots, a_n?$	$p \leq \frac{1}{4}$
Panzi anaanzia katika asili (0,0) kwenye mfumo wa viwianishi na anaruka mfululizo wa marukio. Kila mruko una urefu wa $5$, na baada ya kila mruko panzi huyo hutua katika nukta yenye viwianishi vyenye namba kamili tu; hivyo basi, kuna maeneo $12$ tofauti ambayo panzi anaweza kufikia baada ya kuruka mara ya kwanza. Ni idadi ndogo zaidi ya marukio mangapi yanahitajika ili panzi aweze kufikia nukta $(2021,2021)$?	578
Kwa kila nambari halisi chanya \( x \), tuchukulie \[ g(x)=\lim_{r\to 0}  ((x+1)^{r+1}-x^{r+1})^{\frac{1}{r}}. \] Tafuta \[ \lim_{x\to \infty}\frac{g(x)}{x}. \]	$e$
Tuwe na \[I(R)=\iint\limits_{x^2+y^2 \le R^2}\left(\frac{1+2x^2}{1+x^4+6x^2y^2+y^4}-\frac{1+y^2}{2+x^4+y^4}\right) dx dy.\]  Tafuta \[\lim_{R \to \infty}I(R).\]	$\frac{\pi \ln 2}{\sqrt{2}}$
Tuseme kwamba uso tambarare umefunikwa na ubao usio na mwisho wenye mraba nyingi zinazofanana za ukubwa wa kitengo kimoja. Ikiwa mraba mwingine wenye ukubwa sawa utawekwa kiholela juu ya uso huo tambarare kwa nafasi na mwelekeo usiohusiana kabisa na mpangilio wa ubao huo, ni uwezekano gani kwamba mraba huo mpya hautafunika kona yoyote ya mraba zilizopo kwenye ubao huo?	$2 - \frac{6}{\pi}$
Kwa nambari nzima chanya $N$, iwe $f_N$ ni kazi iliyoelezwa kwa \[ f_N (x)=\sum_{n=0}^N \frac{N+1/2-n}{(N+1)(2n+1)} \sin\left((2n+1)x \right). \] Tafuta thamani ndogo kabisa isiyobadilika $M$ inayoridhisha sharti kwamba $f_N (x)\le M$ kwa kila $N$ na kwa kila nambari halisi $x$.	$\frac{\pi}{4}$
Iwe $n$ ni namba nzima chanya, na iwe $V_n$ ni seti ya kundi la namba nzima zenye urefu $(2n+1)$, yaani $\mathbf{v}=(s_0,s_1,\cdots,s_{2n-1},s_{2n})$, ambapo $s_0=s_{2n}=0$ na $|s_j - s_{j-1}|=1$ kwa $j=1,2,\cdots,2n$. Fasili \[ q(\mathbf{v})=1+\sum_{j=1}^{2n-1}3^{s_j}, \] na iwe $M(n)$ ni wastani wa $\frac{1}{q(\mathbf{v})}$ kwa $\mathbf{v}$ zote katika $V_n$. Tafuta thamani ya $M(2020)$.	$\frac{1}{4040}$
Iashirie kwa $\mathbb Z^2$ mkusanyiko wa pointi zote $(x,y)$ katika bapa zenye viwianishi vya namba kamili. Kwa kila namba kamili $n\geq 0$, iwe $P_n$ ni seti ndogo ya $\mathbb{Z}^2$ inayojumuisha pointi $(0,0)$ pamoja na pointi zote $(x,y)$ zinazotimiza sharti kuwa $x^2+y^2=2^k$ kwa namba kamili yenye $k\leq n$. Bainisha, kama kipengele cha $n$, idadi ya seti ndogo zenye pointi nne ndani ya $P_n$ ambazo vipembe vyake ni vipeo vya mraba.	$5n+1$
Kwa kila $n\ge 1$, iwe $a_n=\sum_{k=1}^{n-1}\frac{\sin(\frac{(2k-1)\pi}{2n})}{\cos^2(\frac{(k-1)\pi}{2n})\cos^2(\frac{k\pi}{2n})}$. Bainisha $\lim_{n\rightarrow \infty}\frac{a_n}{n^3}$.	$\frac{8}{\pi^3}$
Tafuta thamani kubwa zaidi inayowezekana ya $\sum_{i = 1}^{10} \cos(3x_i)$ kwa nambari halisi $x_1, x_2, \dots, x_{10}$ zinazokidhi sharti $\sum_{i = 1}^{10} \cos(x_i) = 0$.	$\frac{480}{49}$
Tafuta nambari zote kamili chanya $n < 10^{100}$ ambazo zinakidhi masharti yote yafuatayo kwa wakati mmoja: $n$ inagawanya $2^n$, $n - 1$ inagawanya $2^n - 1$, na $n - 2$ inagawanya $2^n - 2$.	$2^{2^l}$ for $l=1,2,4,8$
Pembe 30 za aikosahedrani ya kawaida zinatofautishwa kwa kuzipa majina ya nambari \(1,2,\dots,30.\) Kuna njia ngapi tofauti za kupaka kila pembe rangi nyekundu, nyeupe, au buluu, kiasi kwamba kila moja kati ya nyuso 20 za pembe tatu za aikosahedrani hiyo ina pembe mbili za rangi zinazofanana na pembe moja yenye rangi tofauti?	$2^{20}3^{10}$
Tuseme kwamba nambari chanya kamili $N$ inaweza kuonyeshwa kama jumla ya nambari $k$ mfululizo za chanya:\[N=a+(a+1)+(a+2)+\cdots+(a+k-1)\]kwa $k=2017$ lakini si kwa thamani nyingine yoyote ya $k>1.$ Kwa kuzingatia nambari zote chanya kamili $N$ zenye sifa hii, je, ni nini nambari chanya ndogo zaidi $a$ inayoweza kutokea katika mojawapo ya maonyesho haya?	16
Mstari katika bapa la pembetatu $T$ unaitwa kigawanya-sawa ikiwa unaigawa $T$ katika maeneo mawili yenye eneo sawa na mzunguko sawa. Tafuta nambari nzima chanya $a>b>c,$ ambapo $a$ ni ndogo kadiri iwezekanavyo, kiasi kwamba ipo pembetatu yenye urefu wa pande $a,b,c$ iliyo na vigawanya-sawa viwili tofautitofauti.	$(a,b,c)=(9,8,7)$
