Kích thước lớn nhất $|S|$ của một tập $S \in \mathbb{C} \setminus \mathbb{R}$ là bao nhiêu, sao cho tất cả các phần tử của tập này đều là các trị riêng của cùng một ma trận $A \in \mathbb{C}^{n \times n}$ thỏa điều kiện $A^3=A^*$, trong đó $A^*$ là ma trận liên hợp Hermite (ma trận phụ hợp)?	6
Một trình mã hóa từ vựng có tập từ vựng $V$ với kích thước $|V|=:n=99$. Đối với mỗi dãy đầu vào $w=(w_1,\dots,w_{99})$, xác định trọng số của nó là nghịch đảo của số lượng các token duy nhất tăng thêm một lần mà không xuất hiện trong nó: $a(w)=(n+1-\left |\cup_{i=1}^n \{w_i\}\right|)^{-1}$. Tính $\sum_{w\in V^{99}}a(w)$. Hãy viết câu trả lời của bạn dưới dạng lũy thừa của $10$.	$10^{980}$
Cho $k \geq 3$ là một số nguyên tố. Ta ký hiệu $K_k$ là đồ thị đầy đủ trên $k$ đỉnh. Ký hiệu $\Delta_k$ là phức hình trừu tượng được định nghĩa như sau: - Tập hợp cơ bản của $\Delta_k$ là $E(K_k)$. - Một tập con không rỗng $A$ của $E(K_k)$ là độc lập (còn gọi là một "mặt") nếu và chỉ nếu đồ thị $(V(K_k),A)$ có bậc không quá 2. Ta ký hiệu $\hat{\chi}(\Delta_k)$ là đặc trưng Euler giảm của $\Delta_k$. Tính $\hat{\chi}(\Delta_k) \mod k$	$\frac{k-3}{2}$
Một hình vuông được vẽ trên một mặt phẳng, và một điểm được đánh dấu trên mỗi cạnh của nó. Sau đó hình vuông bị xoá đi, và bốn điểm đánh dấu còn lại. Làm thế nào để bạn có thể tìm các đỉnh của hình vuông từ đó (tức là khôi phục lại hình vuông)? Giả sử tọa độ của các điểm đánh dấu là (0.3511,0.2027), (0.6753,0.8303), (-0.2845,0.9905) và (-0.128,0.2218). Xác định tọa độ các đỉnh của hình vuông. Trong câu trả lời của bạn, hãy viết ra 4 cặp tọa độ của các đỉnh của hình vuông với độ chính xác 2 chữ số thập phân sau dấu phẩy, theo thứ tự tăng dần của tọa độ x.	(-0.5,0.87),(0,0),(0.37,1.37),(0.87,0.5)
Cho một tập hợp compact $C$ trên mặt phẳng thỏa mãn điều kiện sau: Với mọi phương hướng, luôn tồn tại một đường thẳng $l$ theo phương hướng đó sao cho kích thước của $l \cap C$ ít nhất là $\frac{1}{2}$. Kích thước nhỏ nhất có thể của $C$ là bao nhiêu?	$\frac{5}{4}$
Cho $B_n$ là nhóm bím tóc trên $n$ sợi. Với $1 \leqslant n \in \mathbb{Z}$, gọi $tr_n$ là dấu vết Ocneanu tương ứng, $H_n$ là đại số Iwahori-Hecke đa tham số được trải rộng bởi $\left\{ T_w | w\in S_n \right\}$, trong đó $S_n$ là nhóm đối xứng trên $n$ phần tử. Cuối cùng, để $f_n : B_n \rightarrow H_n$ được cho bởi $f_n (\sigma_i) = T_i$. Tính $tr_2 \circ f_2 (\sigma_1 ^{-3})$.	$2q^{-1}+q^{-2}(z^2-1)$
Tìm giá trị chính xác của góc $\alpha$ (theo radian) dưới dạng $\arctan()$ cho sự ổn định $A(\alpha)$ của sơ đồ số BDF4.	$-\arctan(-\sqrt{24}\frac{699}{1024})$
Cho $f(x)=x^3+ax^2+bx+c$, trong đó $a,b\in\mathbb{R}$. Giả sử rằng không có $k\in\mathbb{Z}$ nào sao cho $$f(k-1)f(k+1)<0.$$ Giả sử rằng $f'(-1/4)=-1/4$ và $f'(1/4)<0$. Tính giá trị chính xác của $f(3)$. Hãy cung cấp giá trị chính xác nếu nó là một phân số, và đừng làm tròn.	$\frac{87}{4}$
Xét bề mặt $S$ của một hình lập phương có độ dài cạnh là $s$. Gọi $P$ là một trong các đỉnh của hình lập phương, và $D\subset S$ là tập hợp các điểm trên $S$ có khoảng cách đến $P$ không vượt quá $\sqrt{2} \cdot s$, trong đó khoảng cách được đo theo bề mặt. Chia diện tích của $D$ cho diện tích của $S$, để đáp án dưới dạng chính xác.	$\frac{\pi + 3 \sqrt{3} - 3}{6}$
Cho S là một bề mặt K3 và C là một đường cong phức của giống 2. Hơn nữa, cho $\rho$ là một phép đối xứng không đối xứng của S và $\psi$ là một phép đối xứng của C. $\rho$ và $\psi$ cùng nhau định nghĩa một phép đối xứng $\rho\times\psi$ của tích Đề-cát S\times C. Phân ngẫu của tích S\times C bởi phép đối xứng là một không gian quỹ tích phức. Gọi M là đa tạp trơn mà chúng ta có được bằng cách thổi tung lên nơi kì dị. Giá trị cực đại của số Hodge $h^{1,1}$ có thể đạt được bằng xây dựng này là bao nhiêu?	81
Hãy xét hệ phương trình vi phân: $$d'(t)=2d^2(t)+(-3u(t)+5u^2(t))d(t)-u(t)(1-u(t))u^2(t), \ u'(t)=(u(t)-1)u^2(t).$$ Chúng ta xét mặt phẳng pha của hệ trên nửa mặt phẳng trên  $u\geq 0$. Tìm đường phân tách của hệ này.	$d=u-u^2$
Đối với một số nguyên dương \( n \), định nghĩa \( f(n) \) là số nguyên dương nhỏ nhất thỏa mãn tính chất sau: Đối với bất kỳ \( n \) số nguyên dương \( x_1, x_2, \dots, x_n \), hàm \( \nu_2\left( \sum_{i \in I} x_i \right) \), trong đó \( I \) biến thiên trên tất cả các tập con không rỗng của \( \{1, 2, \dots, n\} \), nhận nhiều nhất \( f(n) \) giá trị nguyên khác nhau. Tìm \[\lim_{n \to \infty} \frac{f(n)}{n \log_2 n}.\]	$\frac{1}{2}$
Có bao nhiêu rừng gốc chiều cao hơn $(F,R)$ của phép phân chia tam giác chuẩn của dải Möbius mà rừng $F$ không sụp đơn giản lên điểm gốc $R$?	2
Xác định số nhỏ nhất N sao cho bất kỳ số nào $\geq N$ đều có thể được viết dưới dạng tổng của những số khác nhau của dạng $2n^2 + 3n + 1$.	494
Bạn được giao nhiệm vụ thiết kế cánh máy bay tối ưu hóa hiệu suất khí động học và tiêu thụ nhiên liệu. Bề mặt cánh được mô hình hóa bởi bề mặt trơn, gọn $ S $ trong $ \mathbb{R}^3 $, được định nghĩa bởi các phương trình tham số $ x(u, v) = (u \cos v, u \sin v, \ln(u+1)) $ với $ u $ trong khoảng $ [1, 3] $ và $ v $ trong $ [0, 2\pi) $. Mục tiêu của bạn là phân tích các tính chất độ cong của bề mặt cánh tại điểm cụ thể $ (u, v) = (2, \frac{\pi}{4}) $ để có thể thực hiện các điều chỉnh nhằm nâng cao hiệu suất khí động học. Tiếp theo, tính độ cong trung bình $H$ của bề mặt cánh tại $ (2, \frac{\pi}{4}) $. Làm tròn kết quả cuối cùng của bạn đến ba chữ số thập phân.	-0.127
