Les canes de Janet pondent 16 œufs par jour. Chaque matin, elle en mange trois au petit déjeuner et en utilise quatre autres pour préparer des muffins pour ses amis. Ce qui reste, elle le vend quotidiennement au marché fermier, au prix de 2 $ l'œuf de cane frais. Combien (en dollars) gagne-t-elle chaque jour au marché fermier ?	18
Une robe nécessite 2 rouleaux de fibre bleue et la moitié de cette quantité en fibre blanche. Combien faut-il de rouleaux au total ?	3
Josh se lance dans la rénovation d'une maison. Il en achète une au prix de 80 000 $ et investit 50 000 $ dans sa restauration. La valeur de la maison augmente alors de 150 %. Quel bénéfice a-t-il réalisé ?	70000
Jacques fait des séries de 3 sprints 3 fois par semaine. Il court 60 mètres à chaque sprint. Au total, combien de mètres court-il par semaine ?	540
Pour garder ses poulets en bonne santé, Wendi leur donne chaque jour trois bols d'aliments mixtes contenant des graines, des vers de farine et des légumes. Elle les nourrit en trois repas séparés. Le matin, elle leur donne 15 bols d'aliments. L'après-midi, elle leur en donne 25 autres. Si son élevage compte 20 poulets, combien de bols de nourriture doit-elle leur donner pour le dernier repas de la journée ?	20
Kylar se rend au magasin afin d'acheter des verres pour son nouvel appartement. Un verre coûte 5 $, mais chaque deuxième verre ne coûte que 60 % du prix. Kylar veut acheter 16 verres. Combien devra-t-il payer pour les acheter ?	64
Toulouse a deux fois plus de moutons que Charleston. Charleston en a 4 fois plus que Seattle. Si Seattle a 20 moutons, combien de moutons Toulouse, Charleston et Seattle ont-ils au total ?	260
Carla est en train de télécharger un fichier de 200 Go. Elle télécharge à la vitesse de 2 Go par minute mais à 40 % de téléchargement, Windows impose un redémarrage pour installer les mises à jour, ce qui prend 20 minutes. Carla doit alors recommencer le téléchargement depuis le début. Combien de temps faut-il pour télécharger le fichier ?	160
Jean conduit pendant 3 heures à une vitesse de 60 mph, puis fait demi-tour après avoir constaté qu'il a oublié une chose très importante à la maison. Il essaie de rentrer en 4 heures, mais perd les 2 premières heures dans les embouteillages. Durant la demi-heure suivante, il conduit à 30 mph, avant de rouler à 80 mph pendant le temps restant sur les 4 heures. Quelle distance le sépare de son domicile à la fin des 4 heures ?	45
Pour les 40 premières heures de travail hebdomadaire, le taux horaire d'Élisa est de 10 $. Pour ses heures supplémentaires, elle perçoit également une rémunération équivalant à 1,2 fois son taux horaire normal. Si cette semaine Élisa a travaillé 45 heures, quel sera son salaire de la semaine ?	460
Un nouveau programme a été téléchargé 60 fois au cours du premier mois. Le nombre de téléchargements au cours du deuxième mois était trois fois supérieur à celui du premier mois. Il a ensuite diminué de 30 % au cours du troisième mois. Combien de fois au total le programme a-t-il été téléchargé au cours de ces trois mois ?	366
Toula a acheté plusieurs pâtisseries différentes à la boulangerie. Elle a acheté 3 douzaines de beignets à 68 $ la douzaine, 2 douzaines de petits gâteaux à 80 $ la douzaine et 6 douzaines de petits gâteaux au fromage à 55 $ la douzaine. À combien s'élève le coût total ?	694
Carlos veut planter un citronnier. Le coût de la plantation est de 90 $. Chaque année, l'arbre produira 7 citrons qui seront vendus au prix de 1,5 $ chacun. L'arrosage et la nutrition de l'arbre coûtent 3 $ par an. Combien d'années faudra-t-il à Carlos pour commencer à gagner de l'argent avec son citronnier ?	13
Mélanie fait de la vente à domicile. Lors de son passage à la maison verte, elle a vendu un tiers de ses aspirateurs, puis 2 autres à la maison rouge, et enfin la moitié de ce qui restait à la maison orange. S'il reste à Mélanie 5 aspirateurs, de combien d'aspirateurs disposait-elle au départ ?	18
Dans un cours de danse comptant 20 élèves, 20 % d'entre eux sont inscrits en danse contemporaine, 25 % en danse jazz et le reste en danse hip-hop. Quel est le pourcentage des élèves inscrits en danse hip-hop ?	60
Un commerçant hésite entre 2 plans d'achat : des bijoux d'une valeur de 5 000 $ ou des gadgets électroniques d'une valeur de 8 000 $. Son conseiller financier spécule sur une hausse de 2,5 % du marché des bijoux et de 1,2 % de celui des gadgets électroniques au cours du même mois. Si le commerçant fait un choix qui lui permet de maximiser son profit à la fin du mois, quel serait le montant de ce profit ?	125
Deux trains partent de San Rafael au même moment. Ils se dirigent d'abord vers l'ouest et parcourent tous les deux 80 miles. Le jour suivant, ils voyagent vers le nord, couvrant 150 miles. Quelle est la distance parcourue par chaque train au cours de ces deux jours ?	230
Jill gagne 20 $ de l'heure en tant qu'enseignante et 30 $ comme entraineuse de majorettes. Si elle travaille 35 heures par semaine en tant qu'enseignante, 15 heures par semaine comme entraineuse et 50 semaines par an, quel est son salaire annuel ?	57500
Pour son petit déjeuner, Claire se prépare une omelette de 3 œufs tous les matins. Combien de douzaines d'œufs mangera-t-elle en 4 semaines ?	7
Marissa fait une randonnée sur un sentier d'une longueur de 12 miles. Elle a mis 1 heure pour parcourir les 4 premiers miles, puis une autre heure pour les deux miles suivants. Si elle veut que sa vitesse moyenne soit de 4 miles par heure, quelle vitesse (en miles par heure) doit-elle atteindre pour parcourir la distance restante ?	6
J'ai 10 litres de jus d'orange composés aux deux tiers d'eau. En voulant les mélanger à 15 litres de jus d'ananas composés aux trois quarts d'eau, je renverse un litre de jus d'orange. Quelle quantité d'eau y a-t-il dans les 24 litres restants ?	15
Raymond et Samantha sont cousins. Raymond est né 6 ans avant Samantha et a eu un fils à l'âge de 23 ans. Si Samantha est maintenant âgée de 31 ans, quel est l'âge du fils de Raymond ?	14
Billy vend des DVD. Ce mardi, il a 8clients. Ses 3 premiers clients achètent chacun un DVD. Les 2 clients suivants en achètent chacun 2. Les 3 derniers n'en achètent aucun. Combien de DVD Billy a-t-il vendus mardi ?	7
Une bougie allumée fond et perd 2 centimètres toutes les heures. Combien de centimètres la bougie aura-t-elle perdus après avoir brûlé de 13 h à 17 h ?	8
Kyle a acheté le livre le plus vendu de l'année dernière à 19,50 $, en bénéficiant d'une remise de 25 % sur le prix initial. Quel est le prix initial du livre ?	26
Marie a commandé un plat de poulet qui coûte 12 $, 5 cartons de lait de 3 $ chacun, 4 pommes de 1,50 $ chacune et quelques boîtes de pizza. Marie a payé en tout 50 $. Si chaque boîte de pizza coûte 8,50 $, combien de boîtes Marie a-t-elle commandées ?	2
Mishka a acheté 3 shorts, 3 pantalons et 3 paires de chaussures. Un short coûte 16,50 $, un pantalon 22,50 $ et une paire de chaussures 42 $. Combien d'argent Mishka a-t-elle dépensé en tout pour l'achat de ces vêtements ?	243
Cynthia mange une portion de glace tous les soirs. Elle achète des cartons contenant 15 portions de glace chacun, au prix de 4,00 $ le carton. Après 60 jours, combien dépensera-t-elle en glace ?	16
Henri a fait deux arrêts pendant son voyage de 60 miles à vélo. Il a marqué son premier arrêt après 20 miles. Il s'est de nouveau arrêté 15 miles avant la fin du voyage. Combien de miles a-t-il parcourus entre les deux arrêts ?	25
Pendant qu'elle achète des chaussures, Gloria tombe sur une paire de bottines qui rentre dans son budget. Toutefois, elle doit choisir entre les bottines et deux paires de talons hauts qui coûtent à elles deux cinq dollars de moins que les bottines. Si l'une des paires de talons hauts coûte 33 $ et que l'autre coûte deux fois plus, quel est, en dollar, le prix des bottines ?	104
Les âges de Darell et d'Allen sont dans le ratio de 7 : 11. Si la somme de leurs âges actuels est de 162, calculez l'âge qu'aura Allen dans 10 ans.	109
Gunter essaie de compter des bonbons dans un bocal. Il demande à ses amis d'en estimer la quantité. L'un d'eux répond 80. Un autre dit 20 de plus que la moitié du premier. Un troisième parle de 25 % de plus que le premier. Quelle est la moyenne de leurs estimations ?	80
Jean s'occupe de 10 chiens. Chaque chien a besoin de 0,5 heure par jour pour se promener et faire d'autres choses. Combien d'heures Jean passe-t-il par semaine à s'occuper des chiens ?	35
Gretchen a 110 pièces. Les pièces en or comptent 30 pièces de plus que celles en argent. Combien Gretchen a-t-elle de pièces en or ?	70
Siobhan a 2 bijoux de moins qu'Aaron. Aaron en a 5 de plus que la moitié des bijoux de Raymond. Si Raymond a 40 bijoux, combien Siobhan a-t-il de bijoux ?	23
Mike joue au ping-pong pendant 40 minutes. Durant les 20 premières minutes, il marque 4 points. Il marque 25 % de points supplémentaires pendant les 20 minutes suivantes. Combien de points a-t-il marqués au total ?	9
Terry mange 2 yaourts chaque jour. On les vend au prix de 4 yaourts pour 5,00 $. Combien d'argent dépense-t-il en yaourt sur 30 jours ?	75
Jean veut vendre tous ses jouets et utiliser l'argent pour s'acheter des jeux vidéos. Il possède 13 jeux de lego et les met en vente pour 15 $ chacun. Finalement, il s'achète 8 jeux vidéos au prix de 20 $ par jeu, ce qui le laisse avec 5 $. Combien lui reste-t-il de jeux de lego ?	2
Jean court 60 miles chaque semaine. Il court 3 jours par semaine. Le premier jour il court pendant 3 heures et court deux fois moins les deux autres jours. Quelle est sa vitesse de course ?	10
Dana court quatre fois plus vite qu'elle ne marche, mais saute deux fois moins vite qu'elle ne court. Si elle saute à une vitesse de 3 miles par heure, combien de miles parcourt-elle en six heures, sachant qu'elle passe 1/3 du temps à courir et 2/3 à marcher ?	18
L'iPhone de Brandon est quatre fois plus vieux que celui de Ben. L'iPhone de Ben est deux fois plus vieux que celui de Suzie. Si l'iPhone de Suzie a 1 an, quel âge à celui de Brandon ?	8
Perg, le grand dragon, était assis au sommet du mont Farbo et crachait du feu sur une distance de 1 000 pieds. Polly pouvait lancer le javelot d'or, la seule arme capable de transpercer le dragon, mais sur une distance de 400 pieds, largement à portée de ses flammes. Toutefois, lorsque Polly tenait la pierre de saphir, elle pouvait le lancer trois fois plus loin. En tenant la pierre précieuse, à quelle distance Polly pouvait-elle se maintenir hors de portée des flammes, tout en parvenant à frapper le dragon avec le javelot d'or ?	200
Grand-mère Jones a préparé 5 tartes aux pommes pour le déjeuner des pompiers. Elle a ensuite coupé chaque tarte en 8 parts et a disposé les cinq tartes sur la table de buffet pour que chacun se serve. À la fin de la soirée, après que tous les invités aient pris et mangé leurs tartes, il en est resté 14 parts. Combien les invités ont-ils pris de parts ?	26
Selon ses informations nutritionnelles, un sac de chips contient 250 calories par portion. Si un sac de 300 g contient 5 portions, combien de grammes de chips allez-vous manger, sachant que votre objectif calorique journalier est de 2 000 et que vous avez déjà consommé 1 800 calories ?	48
Charlie veut vendre des bougies en cire d'abeille. Chaque livre de cire d'abeille lui permet de produire 10 bougies effilées. Une livre de cire d'abeille et de mèches est livrée au prix de 10,00 $. S'il produit et vend 20 bougies, quel est son bénéfice net, sachant que chaque bougie est vendu à 2,00 $ ?	20
Mérédith est une blogueuse freelance dont le travail consiste à rédiger des articles sur les thèmes de la santé et à les soumettre chaque jour aux clients. Un article de blog demande 4 heures de travail en moyenne, ce qui inclut les recherches et la rédaction. La semaine passée, elle a rédigé 5 articles le lundi et 2/5 de fois plus d'articles le mardi. Le mercredi, elle a écrit deux fois plus d'articles qu'elle n'en a écrit le mardi. Calculez le nombre total d'heures passées à rédiger des articles durant ces trois jours.	104
Avant d'aller travailler au café, Candice a mis 80 pense-bêtes dans son sac à main. En chemin, elle s'est arrêtée pour acheter un paquet de pense-bêtes au magasin. Arrivée au travail, elle a placé un pense-bête sur chacune des 220 tasses de café. Si par la suite il ne lui restait plus que 23 pense-bêtes, combien y avait-il de pense-bêtes dans le paquet qu'elle a acheté ?	163
Jean achète deux fois plus de cravates rouges que de cravates bleues. Les cravates rouges coûtent 50 % de plus. Il a dépensé 200 $ pour les cravates bleues qui coûtent 40 $ chacune. Combien a-t-il dépensé en cravates ?	800
Pour soutenir les plants de tomates de son jardin, Tracy a utilisé un fil de fer d'une longueur de 4 pieds. Ce fil a été coupé en plusieurs morceaux de 6 pouces de long. Combien de morceaux a-t-elle obtenus ?	8
Richard vit dans l'un des appartements d'un immeuble de 15 étages. Chaque étage contient 8 appartements. Sachant que les 3/4 de l'immeuble sont occupés, quel est le nombre total d'appartements inoccupés de l'immeuble ?	30
Lloyd est propriétaire d'un poulailler. Ses poules produisent 252 œufs par jour et ils les vend à 2 $ la douzaine. Combien Lloyd gagne-t-il par semaine avec ses œufs ?	294
La bateau de Tom se déplace à 10 miles par heure. Il navigue de 13 h à 16 h, puis entreprend le trajet retour à la vitesse de 6 miles par heure. Combien de temps lui faudra-t-il pour rentrer ?	5
Le sac d'Uriah devient trop lourd pour lui. Il doit réduire son poids de 15 livres. Chacune de ses bandes dessinées pèse 1/4 de livre et chacun de ses jouets 1/2 livre. S'il enlève 30 bandes dessinées, combien lui faudra-t-il enlever de jouets ?	15
Un mécanicien pratique différents tarifs de réparation des pneus de camions et de voitures. Pour chaque pneu de camion réparé il facture 60 $, et en facture 40 pour chaque pneu de voiture. Jeudi, il répare 6 pneus de camion et 4 pneus de voiture. Vendredi, il répare 12 pneus de voiture et n'en répare aucun de camion. Le jour où les revenus étaient les plus élevés, combien d'argent le mécanicien a-t-il gagné en plus ?	40
Les sœurs Doubtfire quittent le refuge local pour animaux, avec dans leur voiture 7 chatons adoptés. Sur le chemin de retour, elles reçoivent un appel de leur mère qui les informe que leur deux chattes domestiques viennent d'avoir des chatons. Elle dit que Patchy, la première chatte, a eu trois fois le nombre de chatons adoptés, tandis que Trixie, l'autre, en a eu 12. Combien de chatons la famille Doubtfire a-t-elle maintenant ?	40
Jean a 30 sucettes. Il en mange 2. Avec les sucettes restantes il veut faire des sacs de 2 sucettes chacun. Combien de sacs Jean obtiendra-t-il ?	14
Pierre prévoit d'aller au cinéma cette semaine. Il achète toujours un billet de 7 $ et 7 $ de pop-corn. S'il dispose de 42 $ pour la semaine, combien de fois pourra-t-il aller au cinéma ?	3
Un camion de livraison est sur le point de traverser un pont en bois qui ne peut pas supporter une charge de plus de 5 000 livres. Le camion est rempli de boîtes identiques, d'un poids de 15 livres chacune. Le poids combiné du conducteur et du camion vide est de 3 755 livres. Combien de boîtes peuvent être chargées sur le camion sans dépasser la limite de poids du pont ?	83
Stéphane a commandé des produits d'épicerie en ligne. Sa facture finale s'élève à 40,00 $. Comme il s'agissait d'un fournisseur de services de livraison, celui-ci a majoré la facture de 25 % et a ajouté 3,00 $ de frais de livraison. Stéphane a également donné un pourboire de 4,00 $. En comptant les frais supplémentaires, quel a été le prix final de la commande de Stéphane ?	57
Un framboisier compte 6 grappes de 20 fruits chacune, ainsi que 67 fruits isolés et éparpillés sur l'arbuste. Combien de framboises y a-t-il au total ?	187
Un panier contient 25 oranges dont 1 est avariée, 20 % ne sont pas mûres, 2 sont acides et le reste est bon. Combien d'oranges sont bonnes ?	17
Janet achète une broche pour sa fille. Elle dépense 500 $ pour se procurer le matériel de fabrication, puis 800 $ supplémentaires pour la réalisation par un bijoutier. Ensuite, elle dépense 10 % de cette somme pour la faire assurer. Combien a-t-elle dépensé au total ?	1430
Si Marcy travaille pour la même entreprise pendant 40 ans, elle reçoit une pension de 50 000 $ par an. À partir de 20 ans de travail, elle a droit à 5 % de ce montant par an. En admettant qu'elle démissionne après 30 ans de service, quelle sera sa pension annuelle ?	25000
Aleena s'est abonnée à un service de streaming qui lui facture 140 $ par mois. Si la société de streaming a facturé ce montant pendant la première moitié de l'année, puis 10 % de moins durant l'autre moitié de l'année, calculez le montant total qu'elle a payé pour le service de streaming à la fin de l'année.	1596
Sophie envisage un voyage en voiture et se demande quelle distance elle peut parcourir avec un seul plein d'essence. Elle a fait 100 miles depuis le dernier plein et a dû rajouter 4 gallons d'essence pour remplir à nouveau le réservoir. Le manuel d'utilisation indique que son réservoir a une capacité de 12 galons d'essence. Combien de miles Sophie peut-elle parcourir avec un seul plein d'essence ?	300
Jim passe 2 heures à regarder la télévision, puis décide d'aller se coucher et de lire pendant la moitié du temps qu'il passe à visionner. Il répète cela 3 fois par semaine. Combien d'heures passe-t-il à regarder la télévision et à lire en 4 semaines ?	36
Un tournoi de basket-ball accueille quatre écoles en compétition. Chaque école a envoyé une équipe féminine et une équipe masculine, chacune comptant 5 joueurs. Les écoles ont également envoyé chacune un entraîneur. Combien de personnes les écoles ont-elles envoyées en tout ?	48
Un chasseur de trésor a déterré un coffre rempli de pierres précieuses. Celui-ci contenait 175 diamants, 35 rubis de moins que la quantité de diamants, et deux fois plus d'émeraudes que de rubis. Combien de pierres précieuses y avait-il dans le coffre ?	595
Les garçons sont deux fois plus nombreux que les filles à l'école du Docteur Wertz. S'il y a 60 filles et 5 élèves par professeur, combien de professeurs y a-t-il ?	36
Bailey a une certaine somme d'argent au départ. Elle reçoit ensuite une allocation hebdomadaire de 5 $ pendant 8 semaines. Si elle se retrouve avec un total de 100 dollars à la fin des 8 semaines, avec combien d'argent Bailey a-t-elle commencé ?	60
En semaine, Judy donne 5 cours de danse tous les jours et 8 cours le samedi. Si chaque cours compte 15 élèves et qu'elle facture 15,00 $ par élève, combien d'argent gagne-t-elle en une semaine ?	7425
Kélian prépare des plats sur la base de deux recettes, l'une avec 20 instructions et l'autre avec deux fois plus d'instructions que la première. Combien d'instructions Kélian doit-il lire pour préparer les deux plats ?	60
Tommy collecte des fonds pour son association caritative en vendant des brownies à 3 $ la tranche et des gâteaux au fromage à 4 $ la tranche. Si Tommy vend 43 brownies et 23 tranches de gâteau au fromage, combien d'argent Tommy a-t-il récolté ?	221
Shiela a acheté cinq téléphones portables au prix de 150 $ chacun, payable en 3 mensualités. Un intérêt de 2 % sera facturé pour chaque unité. Quel montant Shiela devra-t-elle verser chaque mois pendant 3 mois ?	255
Artie vend des fleurs au marché fermier. Il en vend de trois sortes : des soucis, des pétunias et des bégonias. Il vend habituellement les soucis à 2,74 $ le pot, les pétunias à 1,87 $ le pot et les bégonias à 2,12 $ le pot. Comme il n'a pas de monnaie aujourd'hui, Artie décide d'arrondir tous ses prix au dollar le plus proche. S'il vend 12 pots de soucis, 9 pots de pétunias et 17 pots de bégonias, combien d'argent gagnera-t-il ?	88
Luc passe du temps à construire des châteaux de sable sur la plage. Il remarque que chaque étage d'un château de sable a la moitié de la surface de l'étage inférieur. Quelle est la superficie moyenne d'un étage, sachant que le château de sable en compte 4 et que l'étage le plus élevé a une superficie de 16 pieds carrés ?	60
Cécilia vient d'acheter un nouveau chiot. D'après le vétérinaire, elle devra lui donner 1 bol de nourriture pour chien tous les jours pendant les 180 premiers jours. Ensuite, elle devra lui donner 2 bols tous les jours jusqu'à la fin de sa vie. Si un sac de nourriture représente 110 bols, combien de sacs de nourriture pour chiens Cécilia utilisera-t-elle au cours de la première année ?	5
Raymond fait deux fois moins de lessive que Sara, et Sara fait 4 fois plus de lessive que David. Sachant que Sara fait 400 livres de lessive, calculez la différence entre la quantité de lessive de Raymond et celle de David.	100
Vincent a le choix entre acheter des fleurs en paquets de 3 pour 2,50 $ ou en paquets de 2 pour 1 $. Combien d'argent économisera-t-il s'il achète 18 fleurs au meilleur prix ?	6
Jean adopte un chien et l'emmène chez le toiletteur pour la somme de 100 $. Le toiletteur lui offre une réduction de 30 %, comme c'est un nouveau client. Combien coûte finalement le toilettage ?	70
Deux filles ont reçu chacune 1/6 des 24 litres d'eau. Un garçon a ensuite reçu 6 litres d'eau. Combien de litres d'eau reste-t-il ?	10
Charlie avait 10 autocollants. Il en a acheté 21 autres dans un magasin du centre commercial et en a reçu 23 pour son anniversaire. Ensuite, il en a donné 9 à sa sœur et en a utilisé 28 pour décorer une carte de vœux. Combien d'autocollants lui reste-t-il ?	17
Grace pèse 125 livres. Alex en pèse 2 de moins que 4 fois le poids de Grace. Quelle est, en livres, la somme de leurs deux poids ?	623
Dan plante 3 rosiers. Chaque rosier compte 25 roses et chaque rose 8 épines. Combien d'épines y a-t-il en tout ?	600
Une équipe de football a joué 22 matchs. Elle a gagné _ fois plus qu'elle n'a perdu. Combien de fois a-t-elle gagné ?	15
Gene confectionne une courtepointe à partir de vieux t-shirts souvenirs. Il a un t-shirt pour chaque voyage de vacances qu'il a fait. Chaque t-shirt constitue un des carrés de la courtepointe. Chaque rangée de carrés correspond à une année de vacances différente. Depuis qu'il a 23 ans, il part en voyage de vacances quatre fois par an. Il a aujourd'hui 34 ans. Combien de carrés sa courtepointe compte-t-elle au total ?	44
Greg a une alarme réglée pour sonner trois fois par jour. Lorsque l'alarme se déclenche, elle sonne jusqu'à ce que Greg l'éteigne. La première fois qu'elle s'est déclenchée aujourd'hui, elle a sonné quatre fois. La deuxième fois, elle a sonné trois fois plus longtemps que la première fois. La troisième fois, elle a sonné deux fois moins longtemps que la deuxième fois. Combien de fois l'alarme a-t-elle sonné en tout ?	22
Une entreprise verse 600 $ par mois à chaque employé. Elle a pour politique d'ajouter 10 % au salaire initial de chacun de ses employés ayant cinq ans d'ancienneté. Si Sylvie vient de passer 5 ans dans l'entreprise en décembre dernier, quel sera son salaire annuel après trois années supplémentaires de service ?	9360
Le premier disque de Marilyn s'est vendu à 10 fois plus d'exemplaires que celui de Harald. S'ils ont vendu 88 000 exemplaires à eux deux, combien d'exemplaires Harald a-t-il vendus ?	8000
Christina organise une fête d'anniversaire et demande 0,75 sac cadeau par invité, vu que 1/4 des invités ne se présentent pas. Sachant qu'elle a invité 16 amis et que les sacs cadeaux coûtent 2 $ chacun, combien va-t-elle dépenser ?	24
Ted le tyrannosaure a prévu d'apporter une salade de pommes de terre au pique-nique des dinosaures. Il sait qu'il en faudra 10 livres pour un dinosaure adulte et la moitié de cette quantité pour un enfant. Si 20 adultes et 5 enfants sont présents au pique-nique, combien de kilos de salade de pommes de terre Ted devra-t-il apporter pour espérer nourrir tout le monde ?	225
Jan a trois fois plus d'animaux de compagnie que Marcia. Marcia en a deux de plus que Cindy. Si Cindy a quatre animaux, combien d'animaux au total ont-elles toutes les trois ?	28
Émilie a 4 enfants qui s'appellent Amy, Jackson, Corey et Jacques. Amy a 5 ans de plus que Jackson et 2 ans de moins que Corey. Si Jacques a 10 ans et 1 an de moins que Corey, quel est l'âge de Jackson ?	4
Autrefois, Lee courait le 400 mètres haies deux secondes plus vite que Gérald. Mais après un changement de régime alimentaire, Gérald a amélioré sa vitesse de 10 %. Si Lee court le 400 mètres haies en 38 secondes, quelle est, en secondes, le temps de course de Gérald après son nouveau régime ?	36
Dans un certain quartier, la population des lapins de compagnie compte douze unités de moins que celle de l'ensemble des chiens et des chats de compagnie. Si pour chaque chien on compte deux chats et qu'il y a en tout 60 chiens, combien d'animaux domestiques y a-t-il au total dans le quartier ?	348
Sur les 200 élèves de CM2, 2/5 sont des garçons et les 2/3 des filles sont membres des scouts. Quel est le nombre de filles qui ne fait pas partie des scouts ?	40
Harry a dormi 9 heures la nuit dernière. Son ami Jacques n'a dormi que 2/3 de ce temps. Comparé à Jacques, combien d'heures en plus Harry a-t-il dormi ?	3
