Lorsque Freda fait cuire des tomates en conserve pour en faire de la sauce, ces dernières perdent la moitié de leur volume. Elle utilise des boîtes de 16 onces qui contiennent chacune trois tomates. La dernière préparation de sauce tomate de Freda a permis d'obtenir 32 onces de sauce. Combien de tomates Freda a-t-elle utilisées ?	12
Des voitures sont coincées dans une file sur l'autoroute. Certaines voitures parviennent à avancer durant les 15 premières minutes de l'embouteillage, puis 20 autres voitures durant les 15 dernières. 5 voitures sortent de la file pour ne pas avoir à traverser l'embouteillage. Sachant qu'il y avait initialement 30 voitures sur l'autoroute, combien de voitures ont traversé l'embouteillage au cours des 15 premières minutes ?	5
Marie adore jardiner. Hier, elle a reçu 18 nouvelles plantes en pot provenant de sa pépinière préférée. Elle en avait déjà 2 sur chacun des 40 rebords de fenêtre de sa grande maison de campagne. Elle a donc décidé que demain, elle prendra sur chaque rebord de fenêtre 1 plante en pot qu'elle offrira généreusement à des amis et à des proches. Combien de plantes en pot restera-t-il à Marie ?	58
Un jour, 4 amis ont rendu visite à Jérôme. Le premier a appuyé sur la sonnette 20 fois avant que Jérôme n'ouvre, le deuxième 1/4 de fois plus que le premier, et le troisième 10 fois plus que le quatrième. Sachant que le quatrième ami a appuyé 60 fois, combien de fois au total la sonnette a-t-elle retenti ?	175
Solo doit lire 4 pages de son manuel de sciences, 20 pages du manuel d'études sociales, 7 pages du manuel d'histoire et 8 pages du manuel de géographie. Ce lundi, il a lu 15 pages. S'il ne lui reste que 4 jours pour terminer sa lecture, combien de pages lui faudra-t-il lire en moyenne chaque jour ?	6
Jean aime boire un verre d'eau au petit déjeuner, au déjeuner et au dîner. Pour finir, il en boit également un avant d'aller se coucher. Il suit cette routine tous les jours de la semaine. Le week-end par contre, il aime se détendre et boire un soda au dîner. Combien de verres d'eau Jean boit-il en une semaine ?	26
Un banc de brouillard arrive de l'océan et recouvre progressivement une ville. Il met 10 minutes pour couvrir 3 miles de la ville. Si la ville s'étend sur 42 miles depuis le bord de l'océan jusqu'au bord opposé à l'intérieur des terres, combien de minutes faudra-t-il au banc de brouillard pour couvrir toute la ville ?	140
Poppy tente de résoudre un puzzle de 1 000 pièces. Elle place un quart des pièces sur le plateau, puis sa mère place un tiers des pièces restantes. Combien de pièces de puzzle reste-t-il à placer ?	500
Cody mange trois fois plus de biscuits qu'Amir. Si Amir mange 5 biscuits, combien de biscuits mangent-ils au total tous les deux ?	20
Jean a 3 boîtes. Chaque boîte mesure 5 x 6 x 4 pouces. Les parois ont 1 pouce d'épaisseur. Quel est le volume intérieur total des 3 boîtes ?	72
Tous les soirs, Frankie regarde la télévision après avoir fait ses devoirs. Lundi et mardi derniers, il a regardé chaque soir un épisode de son émission préférée pendant 1 heure. Mercredi, il a regardé quelques épisodes d'une émission de 30 minutes. Jeudi, il a fini ses devoirs plus tôt et a regardé un épisode d'une heure et une émission de 30 minutes. Vendredi, il a pu veiller tard en raison du week-end, et a donc regardé deux épisodes d'une heure chacune. S'il a regardé en tout 7 heures de télévision, combien d'épisodes de 30 minutes a-t-il regardé mercredi ?	3
Henri prépare des cookies pour un concours local de pâtisserie. Il veut en faire deux fois plus que l'année dernière. A la fin de la fournée, il constate qu'il a fait 15 cookies de plus que prévu. Il fait tomber 5 de ses biscuits pendant qu'il les fait refroidir et se retrouve avec un total de 110 biscuits. Combien de biscuits Henri a-t-il préparés l'année dernière ?	50
Une station-service vend de l'essence à 3,00 $ le gallon. Une société d'application offre 0,20 $ de remboursement par gallon si vous faites le plein dans cette station. Si quelqu'un achète 10 gallons d'essence, quel sera le prix d'achat, après les remboursements ?	28
Marcell et Béatrice s'affrontent pour savoir qui des deux mange le plus de roulés aux fruits. Ils en déroulent donc autant qu'ils en trouvent. Malheureusement, à cause d'une erreur, Béatrice se retrouve avec deux roulés larges et 24 roulés longs, tandis que Marcell obtient trois roulés larges et 14 roulés longs. Si chacun des deux a entièrement mangé ses roulés, combien en ont-ils mangé en moyenne ?	45
Une fuite s'est produite dans le bateau de Julia alors qu'elle se trouvait sur le lac. Le bateau a commencé à prendre deux litres d'eau tous les dix pieds ramés en direction de la rive. Il lui a fallu seize secondes pour parcourir vingt pieds. La rive étant à 64 secondes, combien le bateau avait-il pris d'eau quand Julia a atteint la rive ?	16
Une salle de classe dispose d'un tableau blanc partagé entre les 4 enseignants qui utilisent la salle à tour de rôle. Chacun d'eux donne 2 cours par jour et utilise le tableau blanc à chaque fois. Si le tableau est nettoyé 3 fois par leçon, combien de fois le nettoie-t-on en une journée ?	24
Chaque jour, Ryan plante 2 fleurs dans son jardin. Sachant que 5 fleurs n'ont pas poussé, combien de fleurs aura-t-il au bout de 15 jours ?	25
Le téléphone de Jamal peut stocker 6 fois plus de photos que celui de Brittany. Le téléphone de Brittany peut en stocker au maximum 50 fois plus qu'il n'y a d'oiseaux sur la photo prise par Jamal, où l'on voit des canards dans le zoo. Si le téléphone de Jamal a une capacité de 1 800 photos, combien de canards peut-on voir sur la photo qu'il a prise ?	6
Quelques temps après avoir acheté du bois de construction, Sasha remarque que les prix ont augmenté de 50 % au cours des derniers mois. Elle décide donc de vendre le bois qu'il lui reste. Il lui reste dix planches de 2 x 4 x 10, qui lui ont coûté 10 $ chacune. Elle a également cinq planches de 4 x 4 x 10 qu'elle a achetées 16 $ la planche. Si elle parvient à toutes les vendre, quel sera son bénéfice ?	90
Katy prépare du café en utilisant des cuillères à café de sucre et des tasses d'eau dans un ratio de 7 : 13. Calculez le nombre de cuillères à café qu'elle a versées, sachant qu'elle a utilisé un total de 120 cuillères à café de sucre et de tasses d'eau.	42
Pour chacun de ses 3 enfants, Jean achète 2 paires de chaussures qui valent 60 $ chacune. Combien a-t-il payé ?	360
Un agent des douanes du port principal de dédouanement de SeaSide a compté 2 conteneurs de véhicules importés, ayant chacun 5 véhicules à l'intérieur. Le jour suivant, de nouveaux conteneurs sont arrivés et ont porté à 30 le nombre total de véhicules présents dans le port. Calculez le nombre de conteneurs importés le deuxième jour, en supposant que tous les conteneurs contiennent 5 véhicules.	4
Le salaire total d'Adrien était de 30 % supérieur à celui de Lylah. Quatre ans plus tard, ce salaire avait augmenté et était de 40 % plus élevé que celui qu'il gagnait au départ. Si les salaires d'Adrien et de Lylah ont augmenté simultanément, et qu'Adrien gagnait 40 000 $ il y a quatre ans, calculez le montant total de leurs deux salaires quatre ans plus tard.	95200
Miguel utilise 2 cartons de papier par semaine pour son dessin. Si chaque carton contient 30 feuilles de papier, combien de feuilles de papier utilise-t-il par mois ?	240
Il a été demandé à Morisette et Kael d'apporter des fruits. Morisette a apporté 5 pommes et 8 oranges, tandis que Kael a apporté deux fois plus de pommes et la moitié moins d'oranges que Morisette. Combien de fruits ont-ils apporté en tout ?	27
Sadie a dormi 8 heures lundi. Elle a dormi 2 heures de moins chacun des deux jours qui ont suivi, à cause de certaines obligations. Sachant que le reste de la semaine elle a dormi 1 heure de plus que lors de ces deux jours, combien d'heures a-t-elle dormi au total durant toute la semaine ?	48
Rosie court à une vitesse de 10 miles par heure pendant 3 heures. Ensuite, elle court 5 miles par heure. Combien de miles aura-t-elle parcouru en 7 heures ?	50
low-fr-124	Jennie apporte une assistance au bureau de sa mère. Elle dispose d'une pile de 60 lettres à timbrer et d'une autre avec des lettres déjà timbrées. Elle tamponne un tiers des lettres à timbrer. S'il y a maintenant 30 lettres dans la pile de lettres timbrées, combien y en avait-il dans cette pile lorsque Jennie a commencé le travail ?	10
