Solo deve leggere 4 pagine dal suo libro di testo di Scienze, 20 pagine dal suo libro di testo di Studi Sociali, 7 pagine dal suo libro di testo di Storia e 8 pagine dal suo libro di testo di Geografia. Solo ha letto 15 pagine lunedì. Se ha altri 4 giorni per completare tutta la sua lettura, quante pagine deve leggere, in media, in un giorno?	6
John ama avere un bicchiere d'acqua con colazione, pranzo e cena. Infine, ne beve uno prima di andare a letto. John fa questo ogni giorno feriale, ma nei fine settimana gli piace rilassarsi e bere una soda a cena. Quanti bicchieri d'acqua beve John in una settimana?	26
Una banca di nebbia arriva dall'oceano per coprire una città. Ci vogliono 10 minuti per coprire ogni 3 miglia della città. Se la città è larga 42 miglia dal fronte oceanico fino al bordo interno opposto, quanti minuti ci vorranno affinché la banca di nebbia copra l'intera città?	140
Poppy sta risolvendo un puzzle da 1000 pezzi. Pone un quarto dei pezzi sul tabellone, poi sua madre pone un terzo dei pezzi rimanenti. Quanti pezzi del puzzle rimangono da mettere?	500
Cody mangia tre volte il numero di biscotti che Amir mangia. Se Amir mangia 5 biscotti, quanti biscotti mangiano insieme?	20
John ha 3 scatole. Ogni scatola è di 5 pollici per 6 pollici per 4 pollici. Le pareti sono spesse 1 pollice. Qual è il volume interno totale di tutte e 3 le scatole?	72
Frankie guarda la TV dopo aver finito i compiti ogni sera. Lunedì e martedì ha guardato un episodio di 1 ora del suo programma preferito ogni sera. Mercoledì ha visto alcuni episodi di un programma di 30 minuti. Giovedì ha finito i compiti presto e ha visto un episodio di 1 ora e un programma di 30 minuti. Venerdì ha potuto restare sveglio fino a tardi per il fine settimana, quindi ha visto due episodi di 1 ora. Se ha guardato 7 ore di TV in totale, quanti episodi di 30 minuti ha guardato mercoledì?	3
Henry sta facendo biscotti per una competizione di pasticceria locale. Vuole farne il doppio rispetto a quanti ne ha fatti l'anno scorso. Quando finisce di cuocere, si rende conto di aver preparato 15 biscotti in più di quanto intendeva. Ne lascia cadere 5 mentre li sta mettendo a raffreddare e ora ne ha un totale di 110. Quanti biscotti ha preparato Henry l'anno scorso?	50
Una stazione di servizio locale sta vendendo benzina a $3,00 al gallone. Una compagnia di app offre un cashback di $0,20 per gallone se fai rifornimento in questa stazione. Se qualcuno compra 10 galloni di benzina, quanto gli costerà la benzina, dopo le ricompense cashback?	28
Marcell e Beatrice stanno facendo una gara per vedere chi riesce a mangiare il maggior numero di frutta roll-up, quindi srotolano quanti più riescono a trovare. Purtroppo, qualcuno commette un errore e quelli di Beatrice erano larghi due roll-up e lunghi 24 roll-up, mentre quelli di Marcell erano larghi 3 roll-up e lunghi 14 roll-up. Se entrambi mangiassero l'intera quantità, quanti ne avrebbero mangiati in media?	45
La barca di Julia si è infiltrata mentre era sul lago. La barca si riempiva di due litri d'acqua ogni dieci piedi che remava verso la riva. Ci voleva sedici secondi per remare venti piedi. La riva era a 64 secondi di distanza. Quanta acqua aveva preso la barca al momento in cui Julia ha raggiunto la riva?	16
Una classe ha una lavagna condivisa tra i 4 insegnanti che si alternano a usare la classe. Ogni insegnante ha 2 lezioni al giorno e utilizza la lavagna in ogni lezione. Se la lavagna viene pulita 3 volte per lezione, quante volte viene pulita la lavagna in un giorno?	24
Ryan pianta 2 fiori al giorno nel suo giardino. Dopo 15 giorni, quanti fiori ha se 5 non sono cresciuti?	25
Il telefono di Jamal può contenere 6 volte più fotografie rispetto a quello di Brittany. Il numero massimo di fotografie che il telefono di Brittany può contenere è 50 volte superiore al numero di anatre nella fotografia di Jamal delle anatre allo zoo. Se il telefono di Jamal può contenere 1800 fotografie, quante anatre si possono vedere nella fotografia di Jamal delle anatre allo zoo?	6
Sasha si accorge che i prezzi del legname sono aumentati del 50% negli ultimi mesi dopo che ha comprato del legname. Poiché ne ha degli avanzi, decide di venderli. Ha dieci assi di legno da 2 x 4 x 10 avanzate che le sono costate $10 ciascuna. Ha anche cinque assi di legno da 4 x 4 x 10 che ha comprato per $16 ciascuna. Se le vende tutte, quanto profitto ottiene?	90
Katy prepara il caffè usando cucchiaini di zucchero e tazze di acqua nel rapporto di 7:13. Se ha usato un totale di 120 cucchiaini di zucchero e tazze di acqua, calcola il numero di cucchiaini di zucchero che ha usato.	42
Giovanni compra 2 paia di scarpe per ciascuno dei suoi 3 figli. Costano $60 ciascuno. Quanto ha pagato?	360
Un ufficiale doganale presso il porto principale di SeaSide autorizzazioni ha contato 2 container di veicoli importati, ciascuno contenente 5 veicoli. Il giorno seguente, sono stati portati più container, e il numero totale di veicoli al porto è diventato 30. Calcolare il numero di container importati il secondo giorno, assumendo che tutti i container contengano 5 veicoli.	4
Il salario totale di Adrien era superiore del 30 percento rispetto a quello di Lylah. Quattro anni dopo, il suo salario era aumentato, e guadagnava il 40% in più rispetto a quanto guadagnava quattro anni fa. Se il salario di Adrien e Lylah aumentasse simultaneamente, e Adrien guadagnasse $40000 quattro anni fa, calcolare il salario totale che i due ricevevano quattro anni dopo?	95200
Miguel usa 2 blocchi di carta a settimana per i suoi disegni. Se ci sono 30 fogli di carta in un blocco, quanti fogli di carta usa ogni mese?	240
Morisette e Kael sono stati invitati a portare frutta. Morisette ha portato 5 mele e 8 arance, mentre Kael ha portato il doppio delle mele e la metà delle arance rispetto a Morisette. Quanta frutta hanno in totale?	27
Sadie ha dormito 8 ore lunedì. Nei successivi due giorni, ha dormito 2 ore in meno ciascun giorno, perché doveva completare alcuni compiti. Se nel resto della settimana ha dormito 1 ora in più rispetto a quei due giorni, quante ore ha dormito in totale durante la settimana?	48
Rosie può correre 10 miglia all'ora per 3 ore. Dopodiché, corre 5 miglia all'ora. Quante miglia può correre in 7 ore?	50
low-it-124	Jennie sta aiutando nell'ufficio di sua madre. Ha una pila di 60 lettere che necessitano di francobolli e una pila di lettere già affrancate. Appone francobolli su un terzo delle lettere che necessitano di francobolli. Se ora ci sono 30 lettere nella pila delle lettere già affrancate, quante ce n'erano in quella pila quando Jennie ha iniziato?	10
